A1: Date | B1: Request By | C1: Customer | D1: Notes | E1: new item or chg, del | F1: Yes if new UPC | G1: Class ID | H1: Item # InvtID | I1: Inventory Description Descr (27-35 characters print on packing slips & reports; field maximum is 60 characters) | J1: UPC Code | K1: Master Item # IRModel InvtID | L1: Size | M1: Cubes StkVol use Col AI formula[1] | N1: Racks StkWt use Col AK formula[2] | O1: GL Acct# DfltSlsAcct | P1: Shelf Life in days | Q1: Supplr1 CustID for 3rd party items | R1: Supplr Item1 3rd party item #s | S1: StdCost 3rd party retail for clearance tag | T1: Dflt SO Unit | U1: Tran Status Code | V1: Flat Ct (system) INUnit CnvFact or blank | W1: Pull Loc ED TL FH EU DE 00 DfltWhseLoc | X1: Drought Tol ? Y=Yes N =No | Y1: System -gen. Tag Y=Yes N =No | Z1: Target TagFormat DT, T SC, T SUN, T SHADE, T HOL, LG ADH, T SPRING | AA1: H Depot TagFormat HANG, LG ADH, H DT, HD PROMO | AB1: Walmart TagFormat W ADH | AC1: Lowes TagFormat L DT, HANG, LG ADH | AD1: Other Cust TagFormat DT, HANG, LG ADH | AE1: Height Top to Bottom in inches by item | AF1: Width Left to Rt in Inches by item | AG1: Depth Front to Back in Inches by item | AH1: case pk | AI1: StkVol Cubes formula[3] | AJ1: # per rack | AK1: StkWt Racks formula[4]
A2: 40168 | B2: Kenny /Dawn | C2: Lowes | D2: for Altman use only, no charge to Lowes | E2: new | G2: WA | H2: 0900181 | I2: LW 8FT 1-SIDE H&V METAL RACK | K2: 0900181 | M2: 90 | N2: 1000.00 | O2: 4910 | S2: 0.00 | T2: EA | W2: 00 | X2: N | Y2: N | AE2: 54.00 | AF2: 96.00 | AG2: 30.00 | AH2: 1 | AI2: =IF(AE2>0,ROUND(((AE2*AF2*AG2)/1728)/AH2,2),"") -> 90 | AJ2: 1 | AK2: =IF(AJ2>0,ROUND(1000/AJ2,2),"") -> 1000.00
A3: 40168 | B3: Kenny /Dawn | C3: Lowes | D3: for Altman use only, no charge to Lowes | E3: new | G3: WA | H3: 0900182 | I3: LW 8FT 2-SIDE H&V METAL RACK | K3: 0900182 | M3: 90 | N3: 1000.00 | O3: 4910 | S3: 0.00 | T3: EA | W3: 00 | X3: N | Y3: N | AE3: 54.00 | AF3: 96.00 | AG3: 30.00 | AH3: 1 | AI3: =IF(AE3>0,ROUND(((AE3*AF3*AG3)/1728)/AH3,2),"") -> 90 | AJ3: 1 | AK3: =IF(AJ3>0,ROUND(1000/AJ3,2),"") -> 1000.00
A4: 40168 | B4: Kenny /Dawn | C4: Lowes | D4: for Altman use only, no charge to Lowes | E4: new | G4: WA | H4: 0900183 | I4: LW 12FT 1-SIDE H&V METAL RACK | K4: 0900183 | M4: 135 | N4: 1000.00 | O4: 4910 | S4: 0.00 | T4: EA | W4: 00 | X4: N | Y4: N | AE4: 54.00 | AF4: 144.00 | AG4: 30.00 | AH4: 1 | AI4: =IF(AE4>0,ROUND(((AE4*AF4*AG4)/1728)/AH4,2),"") -> 135 | AJ4: 1 | AK4: =IF(AJ4>0,ROUND(1000/AJ4,2),"") -> 1000.00
A5: 40168 | B5: Kenny /Dawn | C5: Lowes | D5: for Altman use only, no charge to Lowes | E5: new | G5: WA | H5: 0900184 | I5: LW 12FT 2-SIDE H&V METAL RACK | K5: 0900184 | M5: 135 | N5: 1000.00 | O5: 4910 | S5: 0.00 | T5: EA | W5: 00 | X5: N | Y5: N | AE5: 54.00 | AF5: 144.00 | AG5: 30.00 | AH5: 1 | AI5: =IF(AE5>0,ROUND(((AE5*AF5*AG5)/1728)/AH5,2),"") -> 135 | AJ5: 1 | AK5: =IF(AJ5>0,ROUND(1000/AJ5,2),"") -> 1000.00
A6: 40168 | B6: Kenny /Dawn | C6: Lowes | D6: for Altman use only, no charge to Lowes | E6: new | G6: WA | H6: 0900185 | I6: LW 16FT 1-SIDE H&V METAL RACK | K6: 0900185 | M6: 180 | N6: 1000.00 | O6: 4910 | S6: 0.00 | T6: EA | W6: 00 | X6: N | Y6: N | AE6: 54.00 | AF6: 192.00 | AG6: 30.00 | AH6: 1 | AI6: =IF(AE6>0,ROUND(((AE6*AF6*AG6)/1728)/AH6,2),"") -> 180 | AJ6: 1 | AK6: =IF(AJ6>0,ROUND(1000/AJ6,2),"") -> 1000.00
A7: 40168 | B7: Kenny /Dawn | C7: Lowes | D7: for Altman use only, no charge to Lowes | E7: new | G7: WA | H7: 0900186 | I7: LW 16FT 2-SIDE H&V METAL RACK | K7: 0900186 | M7: 180 | N7: 1000.00 | O7: 4910 | S7: 0.00 | T7: EA | W7: 00 | X7: N | Y7: N | AE7: 54.00 | AF7: 192.00 | AG7: 30.00 | AH7: 1 | AI7: =IF(AE7>0,ROUND(((AE7*AF7*AG7)/1728)/AH7,2),"") -> 180 | AJ7: 1 | AK7: =IF(AJ7>0,ROUND(1000/AJ7,2),"") -> 1000.00
A8: 40168 | B8: Kenny /Dawn | C8: Lowes | D8: for Altman use only, no charge to Lowes | E8: new | G8: WA | H8: 0900389 | I8: LW BANNER GROW YOUR OWN HERB & VEGGIE | K8: 0900389 | M8: 0.08 | N8: 20.00 | O8: 9101 | S8: 0.00 | T8: EA | W8: 00 | X8: N | Y8: N | AE8: 16.00 | AF8: 36.00 | AG8: 0.25 | AH8: 1 | AI8: =IF(AE8>0,ROUND(((AE8*AF8*AG8)/1728)/AH8,2),"") -> 0.08 | AJ8: 50 | AK8: =IF(AJ8>0,ROUND(1000/AJ8,2),"") -> 20.00
A9: 40168 | B9: Kenny /Dawn | C9: Lowes | D9: for Altman use only, no charge to Lowes | E9: new | G9: WA | H9: 0900390 | I9: LW BANNER PLANT THE POT HERB & VEGGIE | K9: 0900390 | M9: 0.08 | N9: 20.00 | O9: 9101 | S9: 0.00 | T9: EA | W9: 00 | X9: N | Y9: N | AE9: 16.00 | AF9: 36.00 | AG9: 0.25 | AH9: 1 | AI9: =IF(AE9>0,ROUND(((AE9*AF9*AG9)/1728)/AH9,2),"") -> 0.08 | AJ9: 50 | AK9: =IF(AJ9>0,ROUND(1000/AJ9,2),"") -> 20.00
S10: 0.00 | T10: EA | AI10: =IF(AE10>0,ROUND(((AE10*AF10*AG10)/1728)/AH10,2),"") ->  | AK10: =IF(AJ10>0,ROUND(1000/AJ10,2),"") -> 
S11: 0.00 | T11: EA | AI11: =IF(AE11>0,ROUND(((AE11*AF11*AG11)/1728)/AH11,2),"") ->  | AK11: =IF(AJ11>0,ROUND(1000/AJ11,2),"") -> 
H12: APPROVAL: | J12: DATE: